,Arabic_Tweets_Cleaned
1605,اللهم اشف كمال شاذلي غير من ابتلي مرض تشفي مرض ذنب ايرضي الله مالناوقد خلا قلب رحم صفاء رسول الله صلي الله سلم دخل جنه الا مخموم قلب قال مخموم قلب تقي تقي لا اثم لا بغي لا حسد فليحمنا الله جميع يقين شر مرض من لا خطيئة استغفر الله تذكر اذ اخطاانسان حساب الله ليس
1606,شكر مجهود قيمة حبذا لو ذكر ناشر سعر كتاب مكان
1607,بدعة اهل خير يساعدو ساعد
1608,حسب الله نعم وكيل وين جيت ترك حال ماشك حنا راضي وضع كذا حمد الله الله ستر جاي
1609,كفاءه اساس غض نظر تمثيل اخوان
1610,بعد
1611,اما خروج اما
1612,محد هالشي
1613,الله وفق ابو عبدالله الله أعان والي امام قلب يدعيلك هذا اجمل قرية اخبار ساره شاء الله ماارجع امريكا الا امور تمام شاء الله
1614,حتي تام مباراة مستوي عالي مفقود
1615,خراشي خراشي جريد غد رجعتوني 45 سن وراء وذكرتموني هذا رجل اسعدني زال قيد حياه رب أعطى صحه طول عمر
1616,ودع احتكم كتاب الذي تءمن
1617,اعتقد جازماان موضوع احتاج مزيد دراسه قبل مختص مءسسه عام غذاء دواء جامعة اردنيه جه جه اخري نن قبل مسءولي افتاء شرعي هيجان حيوان قبل ذبح ضرب قضيب حديدي كما حصل احيا مسالخ يءدي تشنج عضلة أطال فتر سمى يبس رمي ذبيحه لاحق لحم أبقى صلب فتر زاد 24 ساعي لا نضج طبخ كما تطبيق طريق ذبح حاليه اخذ قبل غرب دون دراس كافي فقط مزيد خضوع معيار اخلاقيه تجاه حق حيوان فعل أنتج لحم ذو لون احمر داكن دليل ركز هيموغلوبين دم نسبة اعلي زاد امكاني فساد شكل اسرع قلل فتر صلاحية عمر خزني نتيج
1618,امس كتب مقال عالي
1619,لا احتاج سفر علاج سوسرا لا
1620,لا احتاج سفر علاج سوسرا لا
1621,اتمني نشر ارقام استفاد من جهة تخطيط اتذكر شرك حاول حصول نوعي معلومة متوفره لدى مءسس احصاء لم نستطع سبب عقلية تري قوه احتفاظ معلومه
1622,40 جنيه فاتور ماء شقة صغير ميت وسخ فاتوره شهر تقريب اللهم لاملجاء الا يك حسب الله نعم وكيل
1623,الله رحم مات مسلم شفى
1624,الله
1625,اصحاب رباعييه تاريخيه فاز خماسي فتح تيربو فتح عداد فتح عامة سرعه بخاخ زمن سجل
1626,انتم اهل جزاءر بلد كذب نفاق
1627,اشعل فتيل فتن اعلام
1628,ملاحظ ارجو نشر عمل بحري راي راي اخر شكر غد اتاح فرصة تعليق
1629,مورد ماقلت اتوقع زاد مكاءن خياطه اعتبر كنز دولة عالم ماعندها زين مكاءن خياط ماهو اغلي ماس تسلم موضوع راءع عديم شطحة
1630,هلا هلا من جاء اعب
1631,مادري يش معط غامدي قاسم اكبر حجم نري مخطء لا وجب حاول أقنع قوه دين ولي دين راي لا يتعدي شخص نظري لكن اذ ترتب كلام انتهاك فعلي فتوي شرعيه وجب عاقب اخير الله ياخذ ماجستير دكتور مراسل هي غير معترف معني شعبي شهادة مضروب مزرو وش توقع من رجل حسب راي هش اجوف ردد ادل جمع دون
1632,حي متبع دارس انتشار الا
1633,الله شفى ويرجعلو صحة عافي لا يريه مكروه
1634,لو لعب هلاك نفس نقص خرج نتيج تاريخي
1635,الله وسع صدر هالصباح الله موقف قرية ضحك بس الله ستر جميع سبب فراغ بنت
1636,كم وقت ذهب هبا منثور
1637,علي نائب شعب تقديم استجواب حكومه موضوع
1638,وش دخل مادري
1639,مواطن اصبح بقره حلوب
1640,اهل
1641,الف مبروك جاهير
1642,احيي رجل امن عام مجهود اجتثاث مثل هي ظاهرة غريب
1643,تعدي ملكيه شخصيه دخول
1644,اين قوت اين جبروت عند تختال تحت برلمان قاتل اجل تمرير قانون ضد فقير اجل حفن مال تاخذ اسيادك هل نسي جبار عند تصول جال في اعتقاد ملك كون
1645,خاص مطلب مزعومه حرك ابريل مطلب تبنى احزاب معارض سنة فعالية متعدد اعلامي سياسي مءسس شرعي طيب احزاب معارض ورقيه بتاع نظام مطلب مزعومه فعالية متعدده وصل لا بلد فاسد انتم ظلم متسلط عصاب منظم سلم شرعيه شفافيه توع تزوير انتخاب
1646,الله وفق
1647,عام 1976 خسر وحدة ذهاب اياب خسر لقب زعيم
1648,انما عطاء نفس
1649,"نعم يادواسر وداع صولة جولة مكان تاريخ عريق دولة زباره "","
1650,ناس مدري شل
1651,شكر شكر زار سياحه مهندس قاءم مشروع تعاون اهالي
1652,الله دولة هتنفذ قرار غصب عشان ريس جديد أمسك ابو فضل
1653,فعل عقل زين قص صدق عقل طفل عمر سنة دخن ما تاثير صحي الله غريب
1654,حال وحدة رد على ملعب اداء نتيج فاز شقيق حب رمثا هدف
1655,400 احتلال عثماني مصر ادي تخلف شعب مصري تخلف شديد لن محا الا 400 سن اخري تنوير خير دليل ذلك برادعي رغم حمل درج دكتوراة الذي لا اعلم مجال ما علاقة مجالي عمل سابق لا وعى امور جيد لا هم واقع سياسي معاصر قدم فعل مصر وضع اقليمي معاصر احتاج قاءد لدى حكم وزن امور رءي مستقبلي علي درج كبير عقلانيه ضبط نفس قبل قدم امر معين مصر بد بل ضروري جد حكم وقت راهن قاءد موسسه عسكريه طلم قضيه فلسطينه لم حل كثير موقف الذي قابل رءيس مبارك ابان حكم دولة تعامل مع منظور رجل عسكري الذي فهم معني قرار حرب لو رءيس دولة مدني تغير وضع تمام حدث لا حمد عقبى خير دليل مثل ذلك محاول اغتيال فاشله الذي تعرض مبارك اثيوبيا وثب تورط سودان لولا حكم قاءد عسكري اعلن حرب سودان سعي خلاف مع تءدي حرب ايض ايض موقف حماس مءيد جماع اخوان مسلم لم منع قاءد حكيم سعي جاهد نحو تعامل قضيه فلسطينه اجل شعب فلسطيني كم موقف تم حد مصريه كيان صهيوني مستفذ داءم ممكن جر مصر حرب ضروس تاتي اخضر يابس ما انجاز نمى لولا حكم قاءد الذي علم تمام علم معني حرب متي يءخذ قرار لكن حال غير حال اسال عاصر حرب قد ابن اخ اب شهيد معني حرب نسب يا ايها شعب الذي ماذال احتاج كثير توعيه انظر امور طريق واقعي لا برادعي لا نور لا جمال مبارك صلح قياد دولة شعب حجم جمهوري مصر عربيه كما اختيار جمال عبد ناصر سادات اختيار ناجح اكثر من نجاح اختيار سادات مبارك خلف فان اختيار مبارك من خلف سوف اذن الله اكثر نجاح لان رجل كل صراح امتلك حكم جعل سوف يا بعد صعب جارى
1656,مورينهو مغرور خل سوى
1657,فاكر يث ذو قوه
1658,صراح أبقى كمل انضمام ابراهيم سعيد زبالك مرتزقه سي خلق تكوين عصاب بابا اربع حرام أطلق نادي زبالك نادي اخلاق معدومه زبالك
1659,اولا عشان بثق حسام بدر جد انشاء الله هيثبت مدرب مش قليل مباره
1660,اشكرك اخ علاء هد صراحه نتمني نشرف كاف عربي
1661,ثماني تسعون مءه لدى طال
1662,مهم فيصلي أحرز هاتريك بطولة موسم حالي كان كاس اردن خزاء الشميساني
1663,من جارنرج الان قرانصه صومال مول اسراءيل ولاننسي فاشا الذي استخدم شارون
1664,عقبال مانحرر اقصي شريف يد عبد الله خير هذا سيف نطهر يهودي لعن
1665,قلب افريقيا
1666,جزيره اكتسح شاب اردن نتيج مباري
1667,نتم يجي كثر صار
1668,حمدلله شكر امحق تشجيع الله الله خلى مهمة واجب محافظ امن الله سبحان والي شف اكثر كذا
1669,عكس
1670,هل معارض نشيط نشر صحيفة هالقنوات ام عالم اصبح قري صغير هالاعلام حر نشر فضاءح
1671,لا ننسي الاي كان خير امه
1672,بيرم
1673,طيب لو مات
1674,حرام على لي عبده امريكا واسراءيل ناس غز شرب مخدر هروب واقع حصار مصر مصر هي حاصر يارب ايدك فاسد
1675,استمر غباء عربي لا نهاي اسراءيل متجذر ارهاب قتل تدمير ليس صاحب لا صديق مصلحة فوق اعتبار هي مثاب راسي مل اختفى تحت سبب أحاط مساح كبير جسد لا تخادعو انفس اسراءيل وراء جميع منضم صهيونيه ماسونيه دولة كفر جانب اصنعو نووي
1676,رحم الله ابا فيصل رحم واسع غفر اسكن فسيح جنة
1677,احمد حسن مغرور جد جد ليس لاعب محترم كما
1678,حقد يملء قلب حاقد احمد ياحسن عند مرض اسم حب ذات كراهي نجاح اخر اتلف اصحاب قلب مريضه استمر نجاح قد يا يموتو حسرة نجم نجم اعتراف عالم هم نجم وهم محاول اقناع حول ناجح أحب احمد حسن ترك سفيه
1679,ءربت ءربت الله ستر
1680,شاء الله قدر نزور لانو شكل
1681,ليسانس حق عافيه توسط لدى عميد حق
1682,يوم كبير اردن عزيز الله يديمك عز فخر
1683,مشى احشم لا أعطى مجال لا نيجد معاكس سوء هروب
1684,داي احب اوج كلام استاذ محمد استاذه منال اعتقد واحد مش هيضحي نفس عرض حياة خطر عشان شوي كلام مصلحة شخصي محب همج
1685,ياحول غير هالبطوله راح
1686,هذا دنيا ما
1687,بس شيف ادامي
1688,رب ياري فاق بقي غيبويه
1689,اعتقد اخي سيف المباراه جمالي اداء وحدة شاب واعد ابلغ رد طروح امس مال مشاكسه مناكفه اكثر موضوعيه عقلانيه
1690,انتم ياصحاب تعليق قولو الله لايبلاني رب تري لاوي هاذي مصايب نسال الله عفو عافيه
1691,هل احد نصح شراء اسهم زين
1692,راعي
1693,الله مسخر دكاتر بش عارف شخص
1694,مثل ذلك اعتقد جميع
1695,عبدالجليل مصطفى وزير تربيه تعليم
1696,مايخافون الله لا يتيم لا
1697,اتفق اخ عبدالمجيد زال راي نتمي جريد رياض راءده ايصال اقتراح مسءول مرور جزل
1698,نبي بلاش غلط دكاتره دكاترهبريءهمن اسم نيف ياريت حد نش رصاصهعشان خلص
1699,لكن لبد عرف انها ليس حد اتخذ
1700,لا وجب انتقد حاكم هذا شكل كبير الذي ليس مبرر ضغوط وقع حاكم سواء جمهور لاعب الذي تظاهر وقوع منطقة جزاء دون داعي أثار انتباه حاكم باني خط ارج تخفيف ضغط حاكم تهيء اجواء أعطى افضل لدى
1701,الله ينصركم اتصال السعوديه
1702,ثلاث
1703,احمد نعيم 000000 ودع تايد شعبي كامل قانون نيابه
1704,مااعتقد مشكلة عاءليه توصل هذا حد فتى هرب بيت تسبب مشكلة حق اهل يش ماتناقش اهل مشكله ثاني مشكل حل مهما صار حجم
1705,غير حاشيه ايا حق باطل لكن باطل
1706,صيغة
1707,صيغة
1708,صيغة
1709,نتمني شفاء
1710,انا الله انا الي
1711,اعتقد قرار ظالم سيما انديه مطلب لم
1712,الله قطع ابليسك كذا معلق
1713,نعم كلام صميم شخصية
1714,توفيق جميع
1715,فكر تراء لجنه سال رادوي هل متضايق كوع ضرب مبارا نصر قال لا عادي ماصار شء اصلا متعود طقاق ياطاق يامطقوق مافي داعي قال بس اعلم مااسامح الا اذ ظهر دم احمر نزيف حاد اما ضرب عادي هو عادي
1716,اصل مستشار
1717,قد اصبح توك توك اكبر مصدر ازعاج مدين قنطره غرب فعلي اقل اكثر نصف ساءقي مستهتر وجد مع سنج مطاوي عصي استخدام مشاجرة وضع اجهز صوت تزعج موت ليس ناءم ولايمر دون وقوع حادث متعلق توك توك سرق حادث صدم ناس سيارة بعض خلاف معاكسة مشاجر توزيع مخدر عند جاء ضابط قرر ايقاف ساءقي توك توك حد استبشر خير لكن اسف فان كثير تكاتك مملوك مخبر امناء شرط صيع عمل مرشد شرط يرش ضعيف نفس من يستخدمونهم حملة مجان هءلاء تم ابلاغ تلفوني مكان حمل لا تعرض شيء غالبي وقع تحت يد اناس بحث قم عيش اسف ضابط لايستخدم اساليب قانونيه مع هو ضابط هم ساءقي توك توك غلاب قام ضرب امام ناس شارع تكسير مركب عمل محضر في اخر كلمة مشى لان اصلا بلد باظت خلاص
1718,يابن حلال 200 ريال اشترى 10 تذكرة عدد جمهور
1719,لان حد لازم احسن بطورس رجل متسلط شعب
1720,اثبت مشجع سمى انفس نادي قرن انعدام وطنيه عنى غير وطنيه معدوم لدى اغو لكن ام صلال عطا ابره قبل كذا شكل نسيتم اوصل كاس عالم انديه بعد قارن انفس نادي عالمي
1721,مصر
1722,حنا طيب
1723,زام فحص دوري مجاني انقبل عذر ساءق كسلان صيان
1724,هو شي قدير اللهم ارنا اعداء اسلام عجاءب
1725,رسال حزب وصل لكن هل شعب مثل شعب اوروبا ذلك حقبه مظلمه ام هناك رجل بلد قدر أوقف عهر ظالم قدر صرف عفريت قبل تحول مارد مرعب
1726,الله بارى وفق جمع بين
1727,لايستغرب دفاع مخالفة حريه
1728,اخ حمد يش تاخذ صفار نزل ملعب
1729,جزا الله
1730,طبع معروف هم مستفيد وضع الذي قاتل تاكيد استمرار انقياد خالي معني فكر تعبير ذات
1731,ما فاس وقع راسي كما قال مثل لم بقي وقت كافي أبعد تاريخ تسليم ارض ميناء اذار 2013 كون موقع مزمع انشاء ميناء جديد غير مناسب نهاءيا لا يءيا لا عملي نتيج اعماق كبيره اءيد اقتراح دكتور محاسن انشاء ميناء اردني سعودي مشترك طلب اشقاء سعودي مبادل اراضي مملكة كما سبق حصل بناء ميناء حسب مواصفة العالميه ليس ميناء كلام
1732,انها تبع سياس خالف
1733,تحي كبير جد جد جد اهل مصر
1734,حلى طرب ليل
1735,الله أعمى كره سله لاق عربي الا
1736,لامانع مراه عمل لكن في خص طبيعة
1737,معقول خير ناس عائش هال منطق مءسس جتماعيه وين
1738,الله عين تعبوكم لا فاءد
1739,خبر حلو عنوان حلو لا زياد اسعار كهرباء لكن قارئ خبر اصب هلع اتمني لا افكر صحيح فان أكمل خبر يفاجء اسعار كهرباء لن ارتفع ربع ثاني عام حالي ربع ثاني انتهى نهاي شهر 2010 هذا نفي صالح نهاي فتره بعد الله ستر
1740,تسولف عرف انها
1741,شكل
1742,اخذ رخص مدرس مرور كويت
1743,فين باقي وزارة مثل زار ماليه تعاون دولي حربيه انتاج حربي لا
1744,الله عالم قامو اشتكى هيءه تصرف
1745,لي مشتكاش
1746,سلام على شكر أحسن قارئ
1747,كاس
1748,موضوع
1749,نفى دكتور تير كان هناك طبق وسطي حقيق بلد عربيه مثل طبق ساهم تغيير مجتمع غرب طبق وسطي مجرد بداية سريع انتكس سبب انقلاب عسكريه معظم قاد ابناء طبقة فقيره شراءح بدويه اكثر شراءح حضريه رغم منطق عربيه شهد ظهور مدينة عالم لكن وفق تير انتقل مدينه اماكن اخري حيث قاد عالم بق منطق مرهون صراع مزمنه بدوي حضر
1750,رب حضر المباراه يد قلب لكن عزيم
1751,شكر اخ سيف خطاب مبارك ود اعلام تهنءه وضع لوح شرف اخ صديق
1752,عربي كمال فرغلي محامي
1753,نعم كم هم اهل رياض حاج مثل مشروع ليس هناك متنفس حقيقي بر كم هم فعل حاج
1754,والي لقاء
1755,والي لقاء
1756,والي لقاء
1757,قال 98 تعليق هنا تءيد برادعي حضرة مش فاهم شاب فيسبوك توع برادعي قعد نت كتب الاف تعليق اسامي مختلف
1758,لابارك الله في ولابتجارتكم اباد قضاء حياه فطريه ادعو مسءول سن قانون جرم صيد كل اشكال توجيه اعلام نبذ قام صيد قتل حيوان طير نمطر رب عالم سبب ذلك حفاض تكامل بيءي الله وراء
1759,مبروك 16 كبير اسيا اذن الله نهاءي سعودي شاب
1760,انني ارجو استفاد كل اقام مثل ندوة اقليميه اولي مجال مكافح مخدر تبادل
1761,لا لوم كويت
1762,يومي هناك تطور اسواء حيث تنوع جراءم شارع بيت مءسس حكوميه مدنيه مءسس ضبط ربط عسكري ارفع
1763,رب رحم رحمة
1764,لايعني فشل فنان صحيح رابح اعطي وان ليس
1765,لا سبيل تقدم رقي محافظه بيءه امن تفعيل دور مءسس تعليميه خدم مجتمع بيءه اقترح انشاء زار خاص بيءه
1766,قال حكومه علي لسان وير تنميه سياسيه المعايطه مواطن اردني عن نمى سياسي فليش شارك كان مواطن ديموقراطي كامل حق شي غادي هي نمى سياسي فصل مزاج حكومه
1767,هناك امر اشعر ضيق حيال حين اري عنوان جريم قتل سرق نصب
1768,من معروف مسيحي داءم عند رسم صليب قال بسم اب ابن روح قدس اله امين اعتقد ان متحد متساوي وان لا فرق بين هل جاز اقول بسم ابن اب روح قدس اله امين بسم اله واحد روح قدس اب ابن هكذا
1769,تكلم صراح وهذاحلو احلي اذاكان كلامج واضح غير همز لمز كل عرف عايض قرني عايش رشيد نجيمي غير غير غير لاتصيرون مثل نعام ينقرويدفن راسي
1770,الا يكفيكم ثلاثون عام جهل ظلم تخلف
1771,عرض مغري منافس سوق شركة اتصال مفيد جد مستهلك حيث جود خدم
1772,وجه نظر
1773,شكر خاص استاذه حليم
1774,عنى كتير سمع هي
1775,با ري تتقبلو حقيقه انو امن عام طلع امر تاجر مخدر قطاع طريق دولة سحاب عارض اغوار
1776,12345 تعب اكتب ارقام لان
1777,توفيق هذا عادة وفاء وفاء ثم وفاء
1778,الف مليون ترليون مبروك غزال
1779,امور كثير اتغيرت بنت حري
1780,ما حب دار شغلن قلب لكن حب سكن
1781,اقسم الله تعرض لسيارتي لم اسمح نال من اشد عقاب
1782,احب خاءف
1783,عشان هي لاعب اردني الو مستقبل
1784,اهنيك مقال
1785,توفيق حسين اربد انشاء الله نتيج تاريخي اسود شمال
1786,امريكا وعزرايل ضحك عليكووبتوكل عقلكو حل مصدق يعملو دولة عبر تاريخ طويل الاف سنة اكدب شعب عالم قتل انبيا لاامان اقصي لايتحرر ابدم قتال شرس غير ذلك حط راسي نامي اهل سلام
1787,لو مافيش سلاح مكن مالقاش مكان سلاح لكن قال مفيش بعد قال اطلع مافيش جريم ادله
1788,يسحبونها امريكا تحويل خليج لان عند احد
1789,مقال جميل باراك الله
1790,عاني هي مشكل تدرب خشوع بدل حافظ
1791,صار دم ثقيل
1792,لا احد وقف قاتل لكن حاكم محكمة شرعي نفذ قانون كما استخدم اخر لكن قبل اتهام نهاءي ثبوت جريمه دافع تم سحل واسط همج هذا جريمه اختفى وراء حزب الله شرط ضليع ذلك رب يشوف مصر بعد الذي وقف كثير
1793,سلم ابو عبدالله قد لا يهمونك اعداء نجاح يريدونك أصبح مثل مصف فشل قادر اذن الله استمرار نجاح دون تاثير مخرب امثال اصحاب بيان تافه
1794,هل زعيم هل بطل دوري مهدي يك هزم ارض شمال ثناء روحة
1795,الله
1796,متعمد
1797,اقترح باني طبق اقصي عقوب سمح قانون اردني جناءي اهم ذلك عبر من
1798,رسال واضح مخدوع
1799,روح
1800,عن غير
1801,ساتحدث ايك اساس
1802,وجب تدارك امر تكاتف مواجه هاذ غزو
1803,الف الف الف الف مبروك
1804,قتل نفس ليس كافر لا زنديق لكن مرتكب كبير كباءر ذنب جاء حديث صحيح قتل نفس شيء عذب قيام
1805,سبب مصاءب بعد
1806,هي علم علم امم امبراطوري اندثر اخري قام اشلاء معني انتماء وطن حاكم تعلم من
1807,من شاعر فصيح نبت داخل حداءق لا حد
1808,بعد صار فقر شماع علم باني بلد ياتي اجهل ناس اغبا عمل أكسب مال لماذا استسلم مطب صغير مثال احساء مزرع قريب ساحل عنى الاف وظاءف ماتحتاج واسط قول
1809,غزا شمال لعب ارض بين جمهورهاوستلعب روح نصر قتالي عالي مسند جماهيري كبير عرف طموح قبل داي المباراه كما علو مباراة
1810,على صبر لاعب نصر لاعب
1811,حابب لعب إستاد امير محمد أزرق عين
1812,نءيد مطلب برادعي تغيير دسور ولي تغيير عداد ميه الله شرك ميه شوي حرام بيسرقوا شعب حكومه ريس عارف راضي لي مش راضي راح أوقع برادعي ود اسهل اسرع 2011 اذن الله سوف تبخر حراميه حزب حاكم ناس قرف
1813,الله اكبر
1814,ماشاء الله مصر شيء عند محلي
1815,حكم قتل
1816,رحم
1817,لا زود قبايل
1818,شاب نسب اعتراض حسون مش انو بدوي أوقف اعب لا قصد هي حكم لو طرد حارس انبسط حسون لكن هم حسون انو ياخذ حارس انذار حتي لعب امام وحدة مش عكس لكن حسون لو لاعب كاسياس كول تفرق نسب
1819,تعليق صورة ثاني غريب
1820,عقبال
1821,لا اعتصام لا
1822,سيد فيصلي زعيم وحدة مارد موضوع مش زعام موضوع قاب كل نادي نادى انصار لقب متعارف
1823,ين بر اي اخبار فكر في اخبار دكتور بردعي مستنيينك تتحفينا افكار
1824,صراع سني شيعي
1825,لازم طلع ولد رجل سرع رأى هان على دمعة رجل مسكين مغلوب امر اين نخوه
1826,استاذ مازن مقال غاب روع تحدث منطلق متعلم خبير لكن كما قال مثل يد نار مو مثل يد ثلج
1827,درى حنلعب بك تصفية
1828,صراح ضحكتنا يبو
1829,كيف استرجع اموال
1830,ابي اقول شي حين انتحار حل ضغط نفسيه مشكلة
