,Arabic_Tweets_Cleaned
4397,سيد فاضل رءيس هيءه حضرة تكلم مشكل تسرب لازم مدرس وضع خط مواجه ذلك ظاهر كلام جميل راءع واح واقع اعترف ارتفاع نسبة تسرب لكن هل تعلم طالب صف ثالث اعدادي لو لم حضر طوال عام دراسي حق دخول امتحان دون قدم استمار بعد انتهاء اول امتحان ذهب ادار مدرسة عمل استمار وارسالهاالي مديريه تابع طالب الله كلام صحيح عاوز عالج قضي تسرب اوضع سياس احترمو عقل شوي تعامل اكن مجموع اغبياء مجتمع متخلف علاج بسيط سهل طبق قانون طالب حضور نسب معين لو طالب تخطى لايحق دخول امتحان علي فكر طول مالتعليم بلاش هنفضل متخلف مدي حياه عاقب طالب متسرب باي
4398,حازم اخذ كارت اصفر كا نالمفروض امتثال قرار حكم
4399,في تاهل فريق كبير فريق ثاني نادي فيصلي شاب اردن جدار استحقاق فوز كبير تاريخي
4400,لا شكر واجب جريد سابع محترمه نافذة اخبار
4401,منع دخول بنون صهيون ارض لذا هذا
4402,توفيق زعيم
4403,وين ضمان اجتماعي لا بس زاد مد تقاعد وين زار عمل الله
4404,شف تعليق نصراوي عرف يش حقق
4405,حسب الله نعم وكيل الله هدى ظال
4406,مبالغة احيا اعتبر مغالطة عند تصور اشياء غير وضع طبيعي غالبي اقباط مصر جمال مبارك حسني مبارك كون فريق كشافه تابع جورج اسحاق مرفق قداس هتف لا عنى لا ساوى اقباط بيحبوا بيدعموا برادعي حضور قداس بناء طلب من نصيح كلا جورج اسحاق حمدي قنديل مستشار الذي يعرفانه وجب لا وجب فعل اعجبني جد حقيقه ربط خبر اقباط خبر انفجار قنصليه مصريه عراق لان طبع رجع فضل الي حال عراق دكتور برادعي الذي اجل وعد جاءز نوبل تجديد فتر وكاله عدل شهادة عدم وجود اسلح عراق وجد ثبت عدم وجود شيء شهيد الذي سقط عراقي مصري الا ضحية ايادي كريم كفاي دكتور دم اطفال شهيد عراق عنق دين
4407,صدقني سمو امير ماهم اطلع صورة
4408,طريق شعور ترجم نبض محبه
4409,طريق شعور ترجم نبض محبه
4410,متي وان
4411,ها حرام تتءتمن اطفال منيح درس صف
4412,ممكن رضى تبعتلي معلزم سال ميل march prince yahoo
4413,زفه
4414,معلش وحدة لو جبة كءوس عالم خسر يوم أصبح اسفل
4415,اخ عبدالدايم بقي اخوه ليس هناك اساء كما ادعى اتكلم نيابه جمهور نادي فيصلي اذ سمحو هذا شان عنى كان اعتبر طول قيمة ام لا
4416,نبي محمد ابن عبد الله صلي الله سلم الله أحب عطاس أكره تثاءب اذ تثاءب احد رد استطاع لا قل ها ها انما ذلك شيطان ضحك من
4417,صراح عند
4418,استخف قوم فاطاعوه
4419,مجعص
4420,موجود
4421,اتعجب عجب تعليق خصوص اخوه
4422,عاب قوي
4423,اسال احمد اتي
4424,قال دين صبر جعل دنيا هم اكبر لكن حمد الله قيام الله حكم
4425,بقي مكان دلوقتي ارصفه قدام مجلس شعب
4426,احسن مدرب
4427,اولا خارجة نفس مشكل رقم تسلم ولي امر اتصل هيءه قام باقي لو بنت يس كذا قضى مشكل معاكسة ما عاد حد جر قط
4428,باراك الله
4429,باراك الله
4430,انظر سطر سابع اسم عمر
4431,صراح وصل قدم مبارا جد راءع يستاهل فوز قال هارد ابو خمس عوض سن
4432,تذكرة حساب الله
4433,اخ يسال امال فين جورج جرجس
4434,هم شيعه
4435,كتلة تجديد
4436,كتلة تجديد
4437,اذ لقي مرمي طريق راح اسعفتو الله تعالى صار مشتبه رءيسي وبيعيفوك عيش تحقيق قضى رايح جاي
4438,ليس ضد تعبير حرية لكن اشك مصدق حدث ثلاثاء
4439,جد حرام افرد مساحه خبر صورة منتهي سذاجه اي تحرش
4440,شاهد يابان صار خايفين تاهل لنهاءيات اسيا
4441,يش رد طعن ابن همام عكس رجل كويس شغل صح عنى الا تب ربع
4442,طيب الله شف عقل عرف لو فعل ثبتو
4443,واد كمان عاوز
4444,اعترف صفق بيع ميناء عقب اراضي محيط غير مبرر لو اخذ عين اعتبار حجم استثمار كبير ضخ شرك بالغ عشر مليار دولار مدي فتر انجاز مشروع بلغ خمس عشرون عام مسكين شاطءنا ضءيل نحن أراد بناء موانيء فندق خمس نجم مصنع طول لا تجاوز ثلاثون كيلومتر
4445,مبارك وحدة مبارك جمهور جميع جمهور وحدة خاص جمهور اردنيه عام ارجو شاب عدم رد تعليق لا أسمن لا أغنى جوع فوز وحدة مستحق عربي لعب مبارا جيد متوقع
4446,تكشف معلومة مثير اثناء مجري تحقيق وحش اطفال سبق تقلد منصب مدير عام احدي شركة مدين خبر قبل تم فصل ثبوت استغلال منصب وظيفي اقام علاقة مشبوه عدد فتاة
4447,مشروع روع رياض محتاج مثل هالمشاريع ياليت زرع وادي انواع مختلف اشجار كان اشجار مثمر متنوع بس لو خريط وضح وصول الي تفصيل وادي وزع افضل ساكن رياض قادم خارج
4448,ياحبيبي ابطال كراتيه بس دوايا رءيس اتحاد بعد كردي احسن لاعب كات
4449,ترك ضحية شفى غليل رءي مات موت
4450,استغرب ارقام محصله حساب قضيه ارقام صرف متضرر الذي لاتتجاوز 17 مبلغ محصله حساب عمل فواءد مبلغ خاص مد مشكله قارب سنة
4451,مبروك منتخب تكوندو يري انشوف منتخب كراتيه
4452,يش اخطبوط توقع فوز هولاندا
4453,عرف خير غير جرب غير
4454,اللهم اصبح امسي حي مات والي نشور ترمذي 466
4455,هذا جن فاشل مفروض
4456,لعب ناقص امام برشلونه
4457,لا حول لا قوه الا الله
4458,لا حول لا قوه الا الله
4459,لا حول لا قوه الا الله
4460,لا حول لا قوه الا الله
4461,لا حول لا قوه الا الله
4462,لا حول لا قوه الا الله
4463,صراخ عويل كان تكلم نادي مضاد خارج وطن اف رياض تعصب اعمي غض طرف سلبية فريق مدلل قبل صحافة متشنجه
4464,دولار ساوى جنيه سته ثلاثون قرش ليس كا ورد
4465,لم بدر من
4466,ناح حمام
4467,على لو قريب عضو مجلس شعب هل عقل اضرب مفتش تموين قريب ترك دون حص اقل حص مدينه
4468,اشكر جريد رياض موضوع ساخن
4469,رسول
4470,اكثر دولة ضرة بيءه
4471,مفروض تم حد استقدام خادم لا
4472,شل لم ثبت عنى عشر مءسس قواءم أسود مستوي عالم قال لم ثبت والا قصد لم ثبت السعوديه مليار قاعده مصباح سحري جت والا علبة مسجد
4473,محب ابو
4474,اعتقد مساس لقم عيش عيش تهديد يءدي ارتكاب حماق كثير مثلما حدث دمياط كثير مدرسة فارحل معلاة وزير قبل استفحل خطر كل معلم مصر لا حلم بل فزع كابوس قد اصبح مقصر واجب اسريه فرط قلق الذي احدث معلاة
4475,لو شخص سعودي اقيم قضي سرق محتوى سياره ادخل سجن عد سنة
4476,فريق لا يتاثر غياب
4477,الله عين هلال مابه الا صبر لكن زعيم
4478,حسب الله انتقاءيه
4479,اضحك دنيا
4480,اهم شي ضمان سرع مخالف
4481,كيف اعتبر اقتصاد جيد
4482,ياخي خش مزاجي هالتعداد
4483,وان سر محبه حاء باء
4484,كلم شان داخلي سمع كثير اندي شمال خصوص حسين صار سمع جمهور اسف شديد لم تطور مستوي فكري احترافي ادار انديتنا ابعد مفهوم كرسي انتخاب اغلاق ابواب عضويه امام ناس انجد تفسير زمان اصبح انديه وارث تبرع خاوي عضويه حسب رغبه شخصي لا اعرف اين انظمه قانون حكم عمل مثل مءسس واين دور مجلس اعلي رياض شاب واين مسءوليه حكومه متابع امور انديه كاتب مبدع باني انديه ملك جميع الغا من تواصل شاب ليس قمع
4485,وحدة
4486,تو
4487,اهي نوعي طلب بيقابلو مدرس فصل ببعدين رجع لام مدرس قال ظالم مفتري يستاهل قطع
4488,الان
4489,لكن شرط صعب ظل عديد
4490,ماهي غريب جمهور اتي سبق وقف دعم ليث طول اسيا جد عام 2001 حقق ليث طول وجود ملعب
4491,احبب فيكي زمان مجدي غابر ضيعة سفه
4492,ساكن مدين حاءل اعاني عدم غطى جيل ثالث تحول اتصال عند جيل ثاني سرعه بطء مقارن شركة اخري وجب تطبيق ابراج جيل ثالث نصف في قري قريب حاءل اعاني عدم غطى موبايلي مثل قري نايل وجد برج اتصال السعوديه لا وجد برج
4493,ذلك جعل برادعي يحظي تقدير تاييد وان طيف سياسه معارض مصريه بدء اخوان مسلم يساري ليبرالي حتي اقباط مهجر
4494,لماذا وقوف اساس مكان وقوف ممنوع مسبق واضح عيان
4495,سمع سي بعد قسم مرتضي رفض شوبير قسم تاكد جميع شوبير كاذب بذيء لازم مرتضي ياخد حق امه الذي سب والا ياليت ولد لا ربة ييجي تافه سب اشرف افضل عشر شوبير ذلك ابن لو ماخذ
4496,لكن سوء تعامل قبل جهاز مسبب كل
4497,تحي حار شب
4498,شكلو
4499,جزية جنه اخي Bello اعلي صوت اقول عاش امه الاسلاميه عاش عروبه عاش جزاءر حي مصر كم احب موحدينك ياجزاءر عروبه ياجزاءر مليون شهيد ايها منافق دخيل ليس مكان بين نحن امه واحد شعب مصري أحب مسلم أحب عربي موحد خصوص مغرب عربي
4500,ذكر حرك مصر مءيدون سياسيه ظهر عام مستوي خمس محافظة هادف نمى حس وطني انتماء لدى شاب مساهمه حل مشكلة تعاون اجهزه معنيه
4501,اسءل مكرر لاتعني شي كثير سبق طرح اصبح ممل ايقاني تام ياسر قحطاني تمتع ثقاف عالي اكثر
4502,مش عارف زمالك عنى اهلي اخد دوري حيصل دنيا حتنقلب
4503,ناس رب هدى هدى حق عاوز قال كلام برادعي راجل محترم كل مقياس مفيش داعي تغير صورة كد ازداد اصال ممكن عاش بعيد دوشه دي بس رب سخر عباد معلوم امن متعمد ضرب مبرح بكر افكركم اغلب امن هيغير راي اخر علشان مش هيقدروا استمر علشان اولاد اتاذوا عدم رءي اربع عشرون ساعي عنى مشدود القم عيال ولاكيلو لحم اولاد انتم فاكر امن قمر ماهو اخوي اخو ابن ابن وزير مساعد مسكين عارف هيقبله رب طيب هيقوله تمام يارب وكل تمام صدقوني لازم رب غير لكن نسال تغير سريع دون هدم اوعذاب تدمير كي عاد نفع اولاد
4504,طبق اخيره طبق وسطي مافي
4505,معرف رجل اعمال امرا لكن عقل مثل
4506,صوت دليل خلا غاب مال
4507,لذا نءجل تصحيح ترك تدخين وقع فاس راسي
4508,ضرور بدء دوري رديف موسم ابقاء منافس لاعب نادي واحد من انعكس ايجاب
4509,فاز طول دوري ممتاز مرة اعوام 96 95 94 91 87 80 97
4510,غامدي طلع كل قوه تكلم ملامه عتب هءيه عالم ساكت والا فكر اطلع اعلام تكلم هذا عاد هءيه علم ابن بازي ابن عثيمين اطلع موضوع ماتستحق طلوع تكلم
4511,منظر واحد عرف رب حسب الله نعم وكيل فيكي اعقدي بيت لا خلع حجاب عشان انتي مسيء حجاب جد
4512,هنوري عمر شافه راي
4513,نظام فاشل مافي توعي ضبط سرع سيارة مافي مشكلة كبير اللهم انصر ظلم شارع فاشل جد سرع 70 تريل مشى 70 اجرام ياللمرور اتقى الله سيارة صغير مفروض سرعه 90 افضل 130 افضل حسبني الله نعم وكيل
4514,اتمني زعيم ليث توفيق
4515,امريكا عين برادعي مدير وكاله اصعد الان ترشح رءاس مصر
4516,نسال الله جنه محاسب متورط فساد حساب
4517,عند عتب مركز عبد لطيف جميل كشف مجاني سرطان ثدي
4518,ثقاف طراطيع بيض ارشح اخو ناصر علي انظمام برلمان احق هذا ديمو قرط لي أمكن توسط وظيف محترم
4519,صراح مر اقرء مقال
4520,لن
4521,سادس مبروك شلاش هدلق عسكر سدسري مقوشي شكر مدرسه
4522,اولا حب اسم ملك قوي ثاني بتمنالك مستقبل جميل زيك كان فنان كبير اشهر واحد عالم كل
4523,وصل الله سلم نبي
4524,لا رب أرضى هذا حكي لا اح أرضى هذا حكي
4525,وشكرللدكتور عبدالله ربيعه رءيس فريق طبي جراحي كل ساهم هذا عمل الله وفق حمى شر
4526,اعلام صحافهمهنهشرف وامانهوعلم ادب اخلاق اخلاص انتماء وثقافهحوار قبول ومظهرعام وحياديهورقي ودبلوماسيهوموهبه مقوم مواصفة مزكوره لا انطبق شوبير اسف اعلامي قديروالخلوق رحمهالله على فايزالزمر مساحهالزمنيه مخصصه برنامج نصف ساعي انهك ناجح محبوب جميع مقياس كان مشاهد تتطالب زياد عدد ساعة برنامج لكن اسف قاءم تلفزيون سياس اخري تحديدالمواعيد غريب اخ اعلامي كما لقبتموه انتم ايهاالصحافيين اعلامي مقرر على 24 ساعهبسخافتهومهاتراته وفهلوتهوكانه اعلان اعلان يبس شيبسي وعموماايها كاتب كلم مقال حق لا يوجدبها اي شطحة علكس لونظرتم افعال شوبير هي كثير لا مثل اعلامي صحفي شريف شوبير عاوز أعدى موجه لي قت عالي على مش قادر مقوم بعد سوف رجع عادة سيءه معروفهلدي جميع عشان كد وافق وهومجبر اي جلس صلح لكن داخل عدم جديه تغيير نفس لان طبيع شوبير انتهازيه مبادء غير موجود مره قاموس جهداللي عمل شيخ جندي وايضاالخلوق محمودسعد سقط سهو من سوف ندم في لان مجاملة ليس شخصيهشوبير متسلقه منافقه كان على كمازكر كاتب وفر جهد لشء افضل أفاد بلد شعب مجاملة مصلحة شخصيه لي رجعتنا وراء شوه سمع مصر مستوي عالم لا ادري حدث قدير محمودسعد شيخ خالدالجندي باقي اعلامي صحفي محترم وضع نفس موقف غير جيد على علامة استفهام لدى قارئ شارع مصري عربي وتحيهوتقديرلجريدهاليوم سابع محترم مجهود طيب نشر خبر الله على حياديه نشر لان زهق واتقهرنا غربة عن حدث ساحهالمصريه يد فاسد متسلق لي اضر بناكثيرا دون تحرك حكومة
4527,عبداللطيف غنام شلهوب
4528,صدق الله الله وفق لدى ابنة معاق الله حظر شي امس اقترض بنك كي اوفر لهاسياره نقل جهز تجهيز داء علي حساب لا اخفي عتب جريدة مفضله جريد رياض اني حاول كل وساءل نشر معاناة ابنة لكن دون فاءد ارسل اداره
4529,اذ كفء ناس لا ناسب صحيح ناس استحيى
4530,عفو أعفى نساء محرم تجنب لا لاق مسلم زنا دين اذ اقرض وفا اهل بيت اعلم زان امرا في درهم بيت زنى غير درهم زان زنى لو جدار لبيب افهم كم مر سمع قصة عامل توصيل طلب فعل فاحشه فتاة سعودي مجان كم مر سمع ساءق اسيوي فعل فاحشه ام فتاة منزل مجان اتعظ قصص ابتعد
4531,اتمني مزيد دعم هيء غذاء دواء ضرور فصل هيء اهمي كلا من حياة حي اطفال حيث اني ساكن مدين اسم دمام اتمني تحويل ميزان امان مدين دمام هءي غذاء دواء لان وضع مدين دمام لم لن تغير لماذا صرف
4532,مالو بال مالو عيد
4533,شاء الله كان هزيم قاسي
4534,ممكن اعرف ازاي مراه هاتطلع منص قضى وهيهحامل وهيهعندها ظرف نساء ازاي هي حكم حق ناس بعد ممكن هي تءءدي خدم
4535,لان انسان شريف قدم استقالة لا مشارك بيع
4536,67 عنجهي استدراك مصر حرب اسراءيل كان مصر دافع ارض ليس فلسطين لم استطاع دفاع مصر فلسطين احتل فلسطين ارض
4537,لو نصر محد عرف هلال لا يبي نافس برشلونه هلال نصر قد
4538,ياتسبديه بس شول أعطى ايا كمخ الله سرق ثاني لا يباعن امريكان لا يعطونهن امريكان زار مثل ياخذ قيمتهن ياخي خل زين متيحف اصغير وبسطبهن سوق جمع عالمي يجيبن سعر
4539,حال معروف جميع سنفور لون ازرق اذن فان لقب ثاني اقترح صلح زعيم سنفور زعيم سنافر احلي شو راي
4540,ابن قتل
4541,عاقبة كان
4542,ليت اقتدى لحم في ارز في حليب اطفال
4543,اعتقد قضى لدى بد دور تاهيل
4544,ذلك حلق مفقوده حياة
4545,الله يجزاك خير ياعبد الله ربيعه شارك فصل
4546,توفيق شاء الله زعيم نصف
4547,نصر وحدة فوز كاس اردن فرح جمهور وحداتي
4548,كما نقى ثوب ابيض
4549,كما نقى ثوب ابيض
4550,كما نقى ثوب ابيض
4551,كما نقى ثوب ابيض
4552,كما نقى ثوب ابيض
4553,كما نقى ثوب ابيض
4554,كما نقى ثوب ابيض
4555,كما نقى ثوب ابيض
4556,كما نقى ثوب ابيض
4557,يث
4558,كان شرك ارامكو مملوك نسب 49 امريكا ليس موجود
4559,اعتقد طالع صرح مسءولي اعضاء حزب حاكم ايام وجد انها تناسب تمام متطلب قبل ظهور برادعي سم مميزه هذا تصريح شر معذر استخدام كلم عاميه حيث اني ارا اشيك كلم كذب اما الان ظهر دكتور برادعي ترديد نغم تغيير الذي لن جنى وراء مصري سوي نكد قص نهاية معروف رصاص طاءش أيقظ حلم وجد انفس امس حاج من ياخذ ايدي خروج حال اعتقد سياد مستشار ما اتاه الله حس سياسي ايقن فكاهه متطلب ذلك مرحله لا قال ريحاني لا قصر لا كسار تعالى اتفرج هنا سياد
4560,تلاعب بنتاءج مباراة هز اجواء كره ايطاليه
4561,لو فاز قطري مبرووك
4562,مصري اتهم اخوان سوداني تواطء رغم دولة سودان فتح بيت
4563,اخص السعوديه هذا واضح
4564,يحترمونها سمى لكن اذ شفت بنت
4565,بدر تو ناس
4566,كثر منغص يلقا مغترب أفسد فرح ايام صيف والي بعض طريق ازرق عمان كاسر جميع انواع سيارة غلاء بنزين خدمة مبالغه شديده اسعار مطعم متنزه فندق كثر مخالفة متعمده غير متعمد رياض 10 سنة مخالفة حزام امان مر واحد فقط في اردن تم مخالفة اجاز اما وقوف خاطيء عدم وجود موقف سرع زاءد طريق عمان عقب محدد سرع 60 80 منطقة تم مخالفة ماشي 103 عنى شي خنق انني اعتقد ياخذ ضريب مرور فقط طريق ذلك أزعج حال ماديه سيءه ناس نازل شهر لكن غير متفاءل قضاء ايام جميل دون ذلك منغص
4567,اعترض اخير أمسك باب احد أقر اعتراض شكاوي
4568,هم اعضاء حزب فاسد
4569,شاب دكتور برادعي
4570,نصر الله ينصركم نصر حق ينصركم حق الذي لا غالب
4571,قلبو
4572,رغم كره احمد عز بس صراح راجل قالش حاج غلط استحق دوشه مصر جيش ليس مرتزق لكن بد دعم جيش امو اسلحه دولة عربيه ود مش عيب لا حاج غلط اخ أحيى حسين عاوز عمل رقع
4573,مننساش
4574,معتقل شاء
4575,انما امم اخلاق
4576,اوه نوبي احب هالكرتون
4577,اتمني توفيق اتفاق شاء
4578,شدي قلوع يابلد
4579,شدي قلوع يابلد
4580,شدي قلوع يابلد
4581,شدي قلوع يابلد
4582,اساس نظم امور ما أفاد مستثمر مواطن اقتصاد لكن رأى فاءده حقق فقط مستثمر علي حساب ضرر لحق مواطن دفع اقساط غير منطقي اقتصاد لان وضع غير متوازن
4583,صعيد انجب
4584,en text/css line line
4585,دولة عالم ديمقراطيه معني رضاء اقليه حكم اغلبيه احتكام لنتاءج صندوق انتخاب تالي فوض تحدث اسم مصري لماذا أراد هدم استقرار بلد تحت دعاوي واهي لا تم استقرار بلد باي صل غاز جدار معبر حد كان اصبحتم ادري امن بلد قاءم اريد اعلم عدد مقارنه جموع مصري مليون مليون عشر مليون عشرون مليون صدقوني ليس تابع حزب وطني لا شرف انتساب الي لكن مغ امن استقرار الذي حقق نظام حكم بلد اذ ذهب احد لاي بلد عربي راي نظر تشفي شماته عين عربي من فعل امثال عندها فقط علم اي جرم ارتكبتوه حق بلد مصر على لا كان ادا هدم حرك اخر تحقيق فشل تحقيق عبر عقد على تنصت صوت عقل تقبل قاعدة لعب حافظ استقرار بلد
4586,ياعم بدر علم لاعب ادب احترام كبيروخصوصا فاشل احمد حسن تكلم اسياد حسام ابراهيم احمد حسن ياخد منشط لفهيا عم احمد قدر قال اي انجاز خروج تصفية كاس عالم سن فضيح قال عميد محصلتش عسكري
4587,معمل غير قابل استهلاك
4588,شكر
4589,لو مجتمع وعى لاك لن لم تواجد مرض كلي غير مجتمعي
4590,عقبال انتهى
4591,هذا
4592,رحم الله لواء زكي بدر قد مسلم مسجد اسم علام صلاه وجه لكن مسلم متدين معتدل عادل كي على اقباط اكثر
4593,قام صباح لقي تقديم جاي فينو تقديم فينو عسا قبل فينو عسا مايردوني
4594,زار داءر حكومي شاهد طقس انتحار جماعي لدى موظف اذ تجمع عدد مدخن غرفة قاع سيء تهويه ياخذ تدخين متواصل لا هواد شرب كمية مفرط قهوه اما مرجع غير مدخن الله ارجو تم تنفيذ قرار تشدد حماي اردني انفس
4595,لا تحسبن الله غافل عن عمل ظالم انما يءخر يوم شخص في
4596,كرش طبع بد يوم بس تنظيف وحشي طبخ نهايه دقيق نوكل اما طبخ ثاني سهل لازم ست بيت نظم وقت لو اشتغل
4597,اما نسب صديق ابو محيسن كل توقع وحدة فاز دوري لا محل كان امر مسال وقت ليس الا كل كتب مقال عبر شعور باني فقد دوري ظمننا ابو
