,Arabic_Tweets_Cleaned
2928,قال جميع يمن جهلاء شيء جهل صابي ابناء بنت هذا دليل لم تقدم شيء وان عاش مثل مثل 00000 لايفرقون شيء وجب حق انسان العالميه تحقق جريمه امثال بلد جهل
2929,مهنة حياه وجب شخص مميز اسطور اسطور كره قدم يو ميس اسطور كل حمل كلم
2930,اب متل هي
2931,المباراه مبثوث شاء الله غلوبل لانو جدول بث مبارا ساعه 30 مبارا تسجيل غير مهم دوري اردني بحذفوها بثو مبارا وحدة شاء الله قال شاء الله راح أحضر مبارا سامبا اردن عرب
2932,والي هذا خطبة راءعه ارج يقراءهاجيدا لان شيخ عاءض قرني اكبر شيخ
2933,قم ابداع اختراع تفنن نهب ماتبقي مال جيب مواطن
2934,شكر فعل حاج مجلس اعلي علم تقني قد مل تخبط غير مدروسهمن قبل مسءل مدين علم تقني لم عد عرف وجه اهداف اونهالاخيره كل مسءل هدف عارض هدف مسءال
2935,يلموني حب رءيس زعيم تعلم من ايها متعصب كان يد واحد
2936,عنى اصعب داءم ابيش حظ سيد بس شالل نلقن يابان
2937,لا حس ساكن قصر
2938,لان حب أوحى ازواج باني أحل مشكلة هدوء يتصالح قبل نوم نام
2939,انتبه على مارادونا منشط بس أخذ
2940,توفيق قرعه
2941,في هذا
2942,نصر مسجل هدف خارج
2943,مبروك
2944,حاج فتح امام جعافره فاقوس شرقي راجل طيب قروي مفكر زكي لكن طيب اولا شاف بقي ياعم حاج اكيد قاعد حكى
2945,نسي اقولك حاج مهم جد اسم كاتب اخر كلام ضهر بييجي عش
2946,عاوز قال موش طابخ حكومه علشان خرجوك غير
2947,عرف مصر شو قصد موضوع ايفهمني مصر شو بد زبط
2948,صباح خير على علي جميع مسلم
2949,الله جمع مابين رزق ذريه صالح
2950,موضوع كان شكك وجود فزعه دون مقابل
2951,لو تعامل ناس اخلاق احترام ماصار صار بس اسف ناس همج اتمني لو شل هيع مو هيء
2952,الله عز ولى
2953,ست الله هي قدوس حي مات
2954,طبع متاكد افضل لاعب طول لاعب زان ابوعرب مشالل مبار
2955,عيب حادث استقال وزير داخليه
2956,توني ادري اني اذ لبس عباي بر طلع كني سارق سيار
2957,تدريس تددريس معلم زياد
2958,تكلم مع قال اتصل
2959,جدار مش مصالح مصر مصالح اسءاءيل اوامر
2960,الذي حدد اسفار
2961,كمان فلسف تتكتب مش فلفسفه جد سلم مسك قلم اداك
2962,حضرة الله قلب على
2963,كيف مزور عنى خطب بنت زوج جار مثل ياخي تاليف كذب اجل اشباع نعر شيطان رجل اهو مزور لا شي بطاقة صحيح بطاقة صحيح ابو صحيح عقد صحيح كون شاهد امام مسجد رجل عادي مايفرق
2964,ياريت IpADdيوصل مصر
2965,راجل حاسس انك مسافر استرالي ليبيا اهي خطوتين بس هرجع اقول اتحاد احمر SORRY اتحاد كره هياجل ماتش ازاي اهلي قدم طلب يترفض اهو اسماعيلي اخر دنيا ولس جاي النهارده هيلعب يو خميس
2966,لاعب هلال
2967,امام يامهندس صاءب موعد نجاح داءم نادي نيابه قادم لان استفتاء شعبية ازال اوهام محاولة تشكيك بشعبيتك ها هم ابناء كفرسوم ليس فقط اقاربك أعاد حق انتصر تعرض غدر خذلان
2968,مبارا شاب خط مدرب تخاذل لاعب الثق زاءده اضاعوبها حلم فوز طول كان فرصة شاب اردن قال كلمة طول اخفق
2969,الله رزق واسع فضل عطاء ابواب خير
2970,ادخل وزارة يستقبلك انسان لا
2971,لام في ياجريده رياض
2972,نسال الله علي عظيم تمم عمل فصل سهل
2973,هل اعان مطلق ارامل حق رعايه ليس كلام
2974,تفاوت حسب
2975,لي مش عاجب رح أرضى امر واقع هولاندا
2976,ممكن احد شرح فكر بناء تعليم عبر مجتمع
2977,بس ماذا عنى اشتري علبة سيجارة ثلاث اسعار ثلاث اماكن
2978,سبحان الله هلال فال خير فقراويه قبل مبارا لعب امام هلال هناك صرف راتب متاخره منسيه سنة مكاف ارشيف حتي هريفي محيسن يوسف خميس راحو نادي طالب حق متاخره قبل مبارا
2979,اهم توعيه مدرسة
2980,ياماشالله تبارك رحمن اجل جاي امطار ياهل عفيف
2981,علم لا نشر اكاذيب بر مر اخري
2982,يا تصريح لاعب اهلي اماراتي قنا ام بي سي أضاف قاءم لاعب الذي خرج ضد سرب مدرب شحاته اشباه اعلامي الذي زال فرصة أتاح تهييج جمهور مصريه ضد مشارك منتخب جزاءري مونديال
2983,كلام جد واقعي منظور قران سن
2984,جن معلم عمان اكثر حرص داي حراك وحد معلم كون صاحب فكر اول نادي احياء نقابه ما تعرض الي هجوم غير مبرر نم ازم ثق معلم
2985,حكومه تعلم علم يقين انها حكوم فاشل مزور مدلس مرتشي حامي فساد مفسد
2986,هل عقل خسار وحدة مبارا واحد دوري بالتالي خسار دوري جعل كتب كان حضيض خرج وحدة كاس اتحاد اسيوي نتيج طبيعي انعدام وزن جميع مدرك باني وحدة خرج عند خسر رفاع هدف وقت بدل ضاءع وحدة متسيد مباراه لكن لا أعطى باني وصف وحدة باني عانى جفاف لم انتهى موسم بقي مباراة كاس اردن اذ فاز وحدة كاس اردن فان وحدة حقق نصف بطولة اتحاد عدد اربع اين مهنيه كتاب وجد عذر لان وحدة كبير خسارة مفاجا كبر خسار فرقة اخري ادعى انها مقدم اصبح شيء عادي جد اثبت شاب اردن اصبح عقد صعب فك سحر شعوذه أبقى شاب اردن شوك حلق محجم بعض فرقة
2987,هيما عرفتش تاخد حق رامي جاي تاخد سنة بس صراح اوسم شكل كمان ارجل والا كانش حصل
2988,امور خجل من رجل أطلق رجل فعل سمع موضوع مثل هذا موضوع لكن هناك امور واضح مثل وضوح شمس كل شاهد عند نزل اسواق
2989,ايض ها مسءوليه مستشفي تسببلها كل ها اضرارمن انزلاق غضروفي غير
2990,اتمني نظام ساهر عون مواطن
2991,مخبز ماهر عبد مقصود معروف 10 شوال وزن خمسون كيلو يومي
2992,فساد صفقة عقد لتي دفع مليار مازلنا مستشفى مستاجر مدرسة مستاجر مسكن عشواء طريق ملتوي
2993,بكره اطلع شعر
2994,اهلو
2995,اجل متي يتاهل محلي اذ اخذ حالم طول
2996,اطلب فضيلهالشيخ غامدي موقرتوضيح مداخلة برنامج خاص الق اولي وضح ملابسة ماادلي تراجع عماافتي
2997,شكر جزل كاتب راءعه سوسن مكحل محترمه قد جاء مقال وقت مناسب فعل شعب نكد مكشر معبس انبور داءم كشره وجه يش مش
2998,قد كتب موضوع دخل مخدر تموليل
2999,صراحه تفكير مضحك منع شاب عزب استمتاع ترفيه مباح اجل من لدى ميل معاكسة تخريب لماذا لا وجد الي قانون حد تصرف هءلاء بدل ثقاف منع جميع الذي نفر شب كثير حب بلد
3000,ليس نمى تنميه غير رجل اعمال مخادع
3001,الف مبروك فوز
3002,الله عظيم اني لن اسامحك قيام ساقف الله اطلب حق لان ضاع
3003,حمدلله عاالمي بس لا كاان
3004,الله وفق وزير صحه ربيعه انجاز باراك الله في في حكومة رشيد سلام ياربيعه
3005,اسوا برنامج
3006,سبحان الله
3007,سبحان الله
3008,سبحان الله
3009,سبحان الله
3010,سبحان الله
3011,سبحان الله
3012,لا حول لا قوه الا الله علي
3013,واكد عضو حزب وطني قاد حزب وطني احدث حال تغيير حراك سياسي
3014,طبع ارحمونا مش الله ارحمونا كف وين نجيب فلس مش الله كف في
3015,ياحبيلك رب أسعد هالضحكه اتمني اشوفك عالطبيعه
3016,ايها قوم سوف نري غير كثير فارجو وفر
3017,قول
3018,قول
3019,جري مسلسل بيع غاز مصري لاسراءيل ظل مثير شك غير قابل تصديق رغم محكم اداريه أعلى اجاز مبدا ادان اجراء تنفيذ فان محكم تاريخ لن رحم احدا ضالع اثنين سواء ظهر صورة غاب
3020,سواء جمهور توام
3021,سواء جمهور توام
3022,احول اقو الا الله تحيااتي اخوي
3023,قرار سليم وجب مرجع اخطاء مبار شرط علاج أعجب حسام حسن عند حمل لاعب مسءوليه تدني مستوي ليس تحكيم رغم
3024,لان اعتراف جعل بسيط ناس الذي قدس اسلام فطرة هاج على
3025,ياصقر سيب من دي احقاد لوبيفهم كلم منشط لان كل علم اعيب اهلي افريقيا كاس امم افريقيا معرض تحليل لكن اعيب سنة هم بيحللوا بول تفرج احمد غانم ابراهيم صلاح صفة حسن
3026,مبلاش حكاي نخبة رجل اعمال لان هم دولة سبب مشكلة بلد دولة مصدر استفزاز شعبي ضد
3027,استاذ محمد جزى الله خير جعل ذخر
3028,دولة طالب اخونا عامل
3029,حال مبروك غزال شمال توام مارد اخضر واعجبني جمهور عند كان هتف نادي وحدة
3030,اما ذلك تاريخ هي زبال
3031,
3032,رض سما نفس اسم اخت قسيس مات سن 1981
3033,ابو شبشب خالد
3034,مكبر
3035,الله روع جمال صانع يابان الله دولة متقدم شي
3036,شاء الله كمل اتحاد
3037,ياجماعه عقل اي قدم ميد زمالك دور اول سوا ان هبنزله
3038,مدرب
3039,واهي غلط مش
3040,اتحد لو اخبار بجيبو سير عربي الله اخوان انتو كم قيمة عند
3041,فعل فيصلي عامل ضج دوري كاس اردن كل مشجع افرقه مهم عند فيصلي كيف فوز تمختر كايد زعيم بتهابك تتمني فوز
3042,اجنبي ماخلي ولد بلد
3043,راجل سوف تحدث تاريخ
3044,مخاطر سيل كثير مكان
3045,قلب لو
3046,خط الاي
3047,نتمني توفيق فنانه من شداد صاير وش زين استاذ فايز مالكي ارجو عدم تكرار حركة مصطلح قديم فنان فنان داءم يا جديد مثل عادل امام ايام ملك فاروق مثل مازال ابتكر لا انشغل نجاح اخفاق لدى موهبه
3048,مصر امس حاج عفلاء
3049,أضاف ودع انجاز سامي
3050,متخصص فهم اقول
3051,الله اروع اغاني قنا عود اعاد روح قلب اغاني فلسطينيه اغاني ثوري تراثي
3052,مبروك تاهل شاب اردن كان قريب امس تصدر مجموع امام جمهور جرة لكن شاب اردن ايخشي احدا دور كاضمه هزيمة ارض اذن
3053,الله أرجع أقر
3054,ورد ربيع دليل
3055,الله حي اصل ديم تاج ناوويحفظ اردن حفظ امر
3056,الله درك
3057,حرام أشار بنان اما سرق سرق ناس والا نطق وظيفة بلاش ازعاج تستاهل شرك حط اجانب عيال بلد مزلبينهم زعم مافي ثق هذا الثق خلو نفع ياليت ومنحاشين اخ يالقهر لكن خير غير لص اهم شي انتبه اخطاء كي تتفادونها
3058,ها ازرق زعيم دايم زعيم ملعب شهد غير
3059,جماع خير يش سلبي يش اطلع موضوع جه ثاني دخل كتاب جينيتس اعلا ضرايب
3060,بس اربع مركز زين تراجع اكثر زين زين لعب لا ادار
3061,لو شراني وحد انتظر عيال سوى كذا
3062,جونا اهل على اولي تالي حي
3063,اجل لو
3064,عشان
3065,ماشي شم نسيم جميل بس مش عيد لينا مسلم صح طيب سمك حلال صح صح طبع بس لم مشوي لم مقلي لم ني صح طبع صح طيب لي ملح أعفى ميكروب ضغط دم تسمم عاوز اقول اخوه مسيحي متعصب عدد لا تجاوز 10 عالمي مصر عيب في مسلم غيور دين اخوان مسلم ان عقيد صواب لا دين غير اسلام سيد عيسي ابن مريم جميع انبياء صلاه سلام الا رسول الله سبحان بقي انبياء مرسل قال انما بشر مثل أوحى انما اله اله صدق الله
3066,أرضى جمهور كءءس
3067,نهض مصر سلبية كتير لكن ايجابي اكتر كفى عماد دين اديب صرف اولاد اسر عمل اعمال خير كتير لكن سلبية مءسسه لا احد أنكر انها
3068,كان اولي قال عدم اعطاء حق تدنيس كرامة عدم احترام تصوير مجتمع باني دلخ كفى باني وزارة موقره رمز غلاف ماد رياضية باني حمار كبير عند احتج شريف عدل صورة قال باني ليس حمار بل بقر هل رايت تقدير هذا نفس ارضي اشتغل موظف نص راتب الان بس
3069,هناك مثل ياباني قال
3070,قد افردتم ايها غد صفح كامل اقناع معلم مبسوط زياده استمرار اعتصام نشرتموه اسفل صفحه ورقيه اقصي يسار عنى بد تقنعونا معلم مبسوط هم حق ضايع
3071,ذمتي قبل مااقرا خبر حسب حرم
3072,صورة كان بصل مقطوع
3073,اجد اختزال موضوع كل عباره
3074,ياالله
3075,اللهم صلي سلم نبي
3076,ساد امن داوو مايضيع
3077,الله نفس كل وصل مرحل نضج عقلي كل شي تعامل زواج تعليم حتي شاهد مسلسل لازم كان ناضج عاقل نضبط مشعر عقلاني
3078,الله كبير يابوعبدالله كلام لا قال سوا
3079,ضرب كوع قوه درجة
3080,استاذ فاضل محمد
3081,كل اجهز شركة سابق احتوى
3082,شخص وزاره لم حل مشكل عاطل
3083,اغسل ماء ثلج
3084,اغسل ماء ثلج
3085,اغسل ماء ثلج
3086,غامدي حاس مسلم
3087,يوم
3088,مفيش احسن شيخ ازهر اول استاذ دكتور محمد سيد طنطاوي رحم الله ادخل جن
3089,سبحان الله حمد سبحان الله
3090,سبحان الله حمد سبحان الله
3091,سبحان الله حمد سبحان الله
3092,سبحان الله حمد سبحان الله
3093,سبحان الله حمد سبحان الله
3094,سبحان الله حمد سبحان الله
3095,سبحان الله حمد سبحان الله
3096,سبحان الله حمد سبحان الله
3097,سبحان الله حمد سبحان الله
3098,سبحان الله حمد سبحان الله
3099,سبحان الله حمد سبحان الله
3100,سبحان الله حمد سبحان الله
3101,سبحان الله حمد سبحان الله
3102,سبحان الله حمد سبحان الله
3103,سبحان الله حمد سبحان الله
3104,سبحان الله حمد سبحان الله
3105,زعيم اسيا يانصراوين مهو لعب
3106,دولة مقدم تطور كبير تطور راح سبب تغير كبير طريق معيشه فهد واقع لازم
3107,اشك شركة تام لدى مشكلة خاص داخلي ذلك بين وكيل حل ليس مسءوليه حكومه متلقي خدم بل شركة ذات حق مستهلك تلقي خدم اسهل طريق اقل تكليف لم نجح هيء قطاع تام زار صانع نشا تحقيق ذلك بل ساهم تغول شركة تام مواطن وابعادالشرط اساسي كل تاجر قاءمه منافس شريف بعيده احتكار
3108,امي غير سعودي لكن تعب كافح ربا ترك ملهي دنيا تفرغ تربى تعليم افضل
3109,فعل شيطان
3110,وش سوى غير راح خاف الله ياخذ
3111,لماذا لاح قطر انسحاب هي استغرب اعلان انديه السعوديه انسحاب طول لقاء ظلم تعرض نصر اعتداء طبيب نادي لاعب اثناء المباراه اعتداء قطر المباراه لماذا طالب اعاد المباراه عارضتم نصر اعاد المباراه شكلتم تكتل ضد انظمه ضد
3112,لماذا لاح قطر انسحاب هي استغرب اعلان انديه السعوديه انسحاب طول لقاء ظلم تعرض نصر اعتداء طبيب نادي لاعب اثناء المباراه اعتداء قطر المباراه لماذا طالب اعاد المباراه عارضتم نصر اعاد المباراه شكلتم تكتل ضد انظمه ضد
3113,حمد
3114,من فاضي مشغول الله ستر
3115,نفس تصرف نعيمه
3116,توفيق زميل اذاعه والي مزيد تقدم خاص اذاع قران كريم
3117,ايارن اسرءايل
3118,علي راي تهامي باشا مفيش كلب رقص كلب
3119,حمد الله
3120,عالمي سوف قال كلمة احد قادم مايحول بين بين تاهل حضور جماهيري راءع اسود
3121,جن انضباط لو فتح باب عقاب أمكن لعب المباراه قادم اشبال نادي كما فعل نصر مع المباراه ماضي احمدو رب اربحو عافيه
3122,الف
3123,الف
3124,الف
3125,عشان حيتم تحصيل رسم سعر قنصلي مليم ماء عشرون دينار
3126,عاءل قلب
3127,لا نسيم
3128,هنا عبر راي لاتسيءو انديه اقل انديه لاعب ابرك قاعد هنا يهايط روح شف روضة زاول بدال ماتهايط هنا
3129,دبي ثوم جديد متي راح نصير
3130,مجمع
3131,نسب باقي قارئ هو موضوع رغب استمرار خدم جيد
3132,بدر
3133,ما ضاع أربى زايد
3134,الف مبروك قطب ثاني كره اردنيه نادي وحدة فورزه طول كاس نتمني يءدي ذلك مزيد تطور كره اردنيه والي امام
3135,ماشف سعودي زي حول ابد
3136,الله زعيم بر جو الله مهم بطولة خارجي طلع فرقة دور قبل
3137,اتمني طالب ثانويه نصيب تعداد تشجيع كسب مهارة
3138,حنا متي حنا حالة
3139,الله رحم احول لا قوه الا الله مااقول الا حسب الله نعم
3140,هم اهلك
3141,هجر ماوصلته خدمة جيل ثالث شبكه رديء تكلم جيل رابع اضرب مثل منطق رايس منطق يا
3142,حقيقه ساكن مخيم برلين عنى يوم الماني ذلك اقوي تاهل اتمني اقوي انتر فوز ساحق بغشا
3143,حضر امي حفل كان فرحة لاتوصف الله عظيم هذا جامع حسنة كثير الله أعطى عامل اداري الف الف
3144,فصل مقدم افضل موت جندي ممكن قدم مر اخري قتل اخر اتم لا تستهينو با ارواح ناس عنى يزعل يرميك بعد خشي واسطه طلب افضل فصل تجنب امور تحدث نفس شخص بعد نفع تنازل
3145,فوز نصراوي اذن
3146,ابراهيم مختار محمد
3147,الله هدى
3148,بد تسكرو عجز جيب
3149,اخواني
3150,فريق وصف همجيه اكيد
3151,اخي عزيز
3152,قياد خادم حرم الشرفين عبد الله ابن عبد عزيز
3153,صرخة
3154,تستاهل دور بس
3155,علاق رياض
3156,الله ميت زواج بس شوفولي وظيف الله اعرف رب محافظ صلاة لا خرابيط بس شو اسوي حين مالي وظيف اجانب ماسكين شي كيف الله على اتزوج بنت حلال كثيير مافي شك من هذا خبر غير صحيح اغلب قبايل
3157,اهلي بقي شماع حاكم علق اخطاء
3158,لف اردن شاف ناس ناس جاع صار تاكل بعض زعران جراءم سرقة
3159,طبع
3160,اللهم ضاعف حسنة كلل توجيه توفيق
3161,الله جماع امر مكبرينو اكثر لازم موضوع معلم حسن ني حاول فرح اهل عمل رسم اطفال اه عرض ولاتحرش جنسي ايش تعود نتصيد هفوة بسيط عمل حب قب الله انها معلم بريء لا قصد اساءه
3162,شهري 200
3163,حقيقه تاهل انتر بايرن لهو غص مشجع ريال من طردتوهم اقصد روبين وشانيدرا هولاندي قاد فرقة ساهم وصول نهاءي مسكين يالريال هارد متعة فريق عالم يابرشا اتمني رحوع رسنيوري ميلان عهد
3164,هل هناك ناشط عمل فكر سواء علم اتي خطط استغلال طريق مباشر غير مباشر تحت شعار تغير اصلاح
3165,بكره جريد شر جزاءريه قال وراء موضوع
3166,هناك فريق استحق القاب اربعه موسم هو شاب اردن لو لدى جمهور حجم جمهور وحدة
3167,اكذوبه اعلاميه
3168,لاتخفوعلي روتبكم خفومن الله هل انتم راضي مصر مهنه جميع شعب عالم مصر تدنى اسم ذهب ريح لماذا لان نظام حول اله محطم هل يرضيكم هل يرضيكم الذي رايتوه سودان يعجبكم ام لا كي يذيدو قبول تورونتو يهينو مصر وصل هذا درج دليل ذلك هل معقول ساءقي اتوبيسات يضلو خط سر تفسسير عند دليل اخر سفير مصر سودان اعترف باني ابلغ زار خرجيه كل شء حصل قبل مبره سبب هذا خفض راوس تراب ااريد اتكلم اكثر ذلك ااريد اجرح بلد مهم عملو ايمن
3169,نظام منقول دون
3170,الله ضربة سيف عز احب يا ضرب سوط
3171,اذ ارد كان شخص سوي نفس لن ته الا نفس كل خطاء خير خطاء تواب قد علم سلف
3172,اجل انفاق ساءل ترفيه سينما
3173,ما نتيج حراك الذي احدث حزب وطني
3174,بس اتمني هلالي تعذر باني فريق لعب
3175,اخ تركي غير متعصب جالس تعدد انجاز منتخب سعودي ولاتحسب جابر جايني قال اربع مرة كاس عالم كاس خليج اسف ليس منطق اذ اهداف جابر كاس عالم جميع عرف سجل ضربة جزاء كل موضوع لازم يحطون ماجد في 21 غص حلق هلالي
3176,عموم نتمني يتاهل وحدة فيصلي عشان كرر رايح جاي سمى طالع
3177,اسباب خسار تجاري كل ماتحمله
3178,يرجي جميع
3179,الله اكبر ابو محيسن رجل قال صام نافلة عرف حق رب جيد لي عرف حق رب زيف حقاءق ادعى علم شيء خاص اذ تعلق امر وحدة
3180,طبق شرع وكف تملق
3181,بس بدي احكي انو ها مستوي فيصلي
3182,اساس شكل بنت ليل هما
3183,هدرج انسان ممكن عمل شالل كان قص كابوس مزعج كذب نيسان شي مش
3184,
3185,ماحب دار شغف قلب لكن حب سكن
3186,مثل شعر جاءز وفق ضابط لا جاز هجاء مقذع غزل
3187,ماهي شرط قبول جامع متخرج جامع امام كلي ودع تقدير جيد قبل خمس سنة ارغب دراس دبلوم عالي اوماجستير هل قبل هل دراسه مساء كم رسم ارجو افاد جزى الله
3188,قرب شعللت
3189,سلام سلام اردن بطل عالم دون كلام الله يحيكم عالاداء جميل الله مع كاس عالم شد هم
3190,حنا بقي شء عشان نبذخ انفقع راسي ادورطريقه ابي احد مصروف اسره تعب شهر قال هالشهر نضبط امور طالع شء جديد غير اقساط غير اللهم باراك في
3191,نرجي رب ثم كتاب
