,Arabic_Tweets_Cleaned
0,مبرووك لكن خلي صاحب مركز رابع عشر لعب صاحب مركز سادس عشر خلا نشوف
1,عشان مقيم أيقظ
2,علاقة بين السعوديه امريكا
3,لكن لم يعجيني
4,فيصلي اثبت مبار امس لا استحق دوري هدي شاب اردن يلقن شيطان أحمر درس فن كره علي يد جمال ابو عابد راءع
5,لماذا منطقة جنوبيه محروم سك حديد ثم وجود سك حديد خصوص منطق جنوبيه خفف ضغط مطار ابها اقليمي اصبح سفر من اشبه امنيه مستحيله بل لم عد احد وجد حجز قبل شهر جرب خير
6,فتش اسراءيل هيلوكوبتر عمل معاهدة حماي ايران
7,الله قام
8,غز حاج ابطال مو حاج اغاني
9,ناس فرح عارم شعب نصراوي
10,اما فقير مافي امل
11,هل كابتن ابراهيم سوف صدر بيان منع تعامل
12,خصص محاسب أفتى
13,عقبال منصب
14,جامع كنايس ملك لي مشغلينك بعد ام حمش انزل حط برادعي زنزانه حق بطلواده
15,هناك افلام رعب افلام تخويف افلام تشويق هنامك افلام مصاص دم كل رعب خوف
16,مثل هناك اغني لازرعلك بستان ورود حول كلمة لافتحلك علبة سردين شوي دالية
17,شفاء
18,فدية عالم
19,خل خرابيط ثاني
20,انسان عند قرين جن ملازم
21,سبيل مثال لا حصر اناجيل اربعه
22,اذ مجرم هو استحق قتل لكن
23,صحفي فاهم عقال جن انضباط دور حالة اغفل حكم اما حال تعامل مع سيد خليل جلال حق أبدى عقوب انتم فاهم قانون لا
24,ياسلام يابو
25,جزى الله خير يادكتور موضوع متميز فضل الله انجب طفل قريب الله حمد فضل متابعه اطباء مركز دكتور سليمان حبيب طبي الله سبحان تعالى انجب طفل سليم علم اني مريض سكري
26,نصيح وجه الله استقدم بحرين فيزا فين راتب 600 ريال خالة مستقدم من شغال
27,الله رحم
28,عند روح رياضي داعي
29,من ضحك انها استغرق تقريب
30,الله رد اهل
31,شاء
32,لغ حب توحد
33,صراح غير تعصب الف مبروك لبرشلونه كاس عالم شكر كاسياس
34,صراح طرح جميل عاد استاذ
35,معلوميه هذا اقوي نتيج جت هلال
36,كسا رجل مهاب
37,ري مصر كتير زيك من رب
38,وش عمل عكس راح صلح بلد احسن بلد يمن
39,رافت ولع كشكش حرق حويطي اشعل سباح
40,أحب واحد درج حرق نفس عشان طيب لي راح اتجوز واضح مش طبيعي حصل خلاف قام يتجوز رفع خلع قام حارق نفس ذم رد افعال انسان سوي عموم اله رحم لان مات خلاص
41,الله احتفال وظيفه ليس
42,رسول كريم يتيم كافل يتيم جنه اوصا قران كريم يتامي مالم أوصى كتاب اخر
43,امطار خير عروس مصيف جاينك صيف يالب عيال شهيد جنوبيه تحية
44,لكن شاء الله نجم زعيم تدارك مثل اخطاء نها المباراه صالح
45,مشكله هاللي أعطى يبون
46,حب اشكركم
47,انشارك اسراءيل حصار غز اما اردوغان هو رجل صلب واسراءيل عمل الف
48,وين راح فلس فاتورة
49,ثنيان احمد هم احق تمثيل
50,اجل بنك سبت تولع
51,اي عظم حسام فين زمان كان محتاج رجل مثل رجل مناسب مكان مناسب نادي
52,جمل
53,دكتور نيف عمل دكتوراة تان ولاد ايمن نور اعرف انها خصص برادعي استاذ رءيس قسم كلي
54,سلم سلام كاس اردن
55,سلم سلام كاس اردن
56,سلم سلام كاس اردن
57,سلم سلام كاس اردن
58,سلم سلام كاس اردن
59,سلم سلام كاس اردن
60,سلم سلام كاس اردن
61,سلم سلام كاس اردن
62,سلم سلام كاس اردن
63,سلم سلام كاس اردن
64,سلم سلام كاس اردن
65,سلم سلام كاس اردن
66,سلم سلام كاس اردن
67,رابع اوباما نفس مسلم سنة اسم بركات حسين اوباما ايوه
68,اكتر تحرش كمان
69,كبير حديد خط
70,شاء الله اما معلم محترم فعل شو صار دنيا عم شو هالوقاحه ها مجتمع حضر معلم لا دين انتمى الله اكبر شو صار مجتمع
71,شيخ احمد
72,شيخ احمد
73,عمليه سهل حاج صرام قوه نظام اولا عبث امن وطن سواء صغير كبير مقيم عرف باني سوف يسجن عشر سنة حق دولة ثاني حق مواطن حدد مختص ثاني مقيم مقيم فيز عمل تام ثلاثون الف ريال وضع حساب دولة خلل عوض مواطن تذكرة سفر من
74,رمى هما ست عامل ظبط بس مش ناوي يسيب موبايل الا
75,الله سواليفكم زين بس احس ان ضاع وقت غير فايد اذ اختلفتو شء نصيح رد قال الله قال رسول قول تعالى الذي خاف نشوز فعظوهن واهجروهن مضجع واضربوهن فان اطعنكن لا بغى على سبيل واضربوهن واضربوهن فهمتو يالحريم
76,شاب قادم يااسيا اذن
77,اعجز هريس
78,كبير وحدة فان فريق وحيد اردن طبق احتراف مبروك بلدوزر محمد جمال تجديد عقبال رافت باقي شاب مبروك توقيع دراج مدرب قدير صحيح صحيح قدم شاب اردن مطلوب رب لم انسجم فريق لكن وجب تذكر وصل فرق اتحاد سعودي الا نهاء دوري ابطال يا ميه هلا مرحبا لاعب اسام ابو طعيم خطو اكثر راءع توفيق جميع سلم سلام كاس كءس
79,هل مطلوب اعلام حكومي شتم حكومه تغزل برادعي لبس شعب سلطانيه الايرانيه
80,اسمراني اتزوج سوري راح عقد محكم صار مثار استغراب نظر حضور فءه مذكوره موضوع زوج بنت هذا اكيد شيء اذ غير سعودي هذا حال كيف لو طيب اسمراني بنت
81,جرح هنا لس
82,جرح هنا لس
83,جرح هنا لس
84,جرح هنا لس
85,تبني
86,مبروك مال من
87,ارجو دكتور نيف تعليق موضوعي ذكر خبر اعتقال اعتداء تم ضد متظاهر طالب مارس حق دستوري مكفول طريق سلمي حضاري ليس تفرغ فقط هجوم اعلامي كبير حمدي
88,توفيق
89,الله وحدة قدس
90,اسف ساهر انطلق لكن اعرج لان غطى ضعيف
91,معظم اعضاء مجلس اعضاء هيء تدريس جامعة طبيعي يوصون شمول اعضاء هيء تدريس سعودي متقاعد مكافا نهاي خدم حصل عند يتقاعدون لكن توصيه اعطاء مكافا عاطل لم أوصى الان لان حصل راتب عالي مكن اعاش ابناء واسطه وظف ابناء
92,اما شيخ خالد جندي
93,بعد قال تجي قال حجاب عنى عشان تراضي لا علماني من لا شو ضبط
94,ناحية استطيع اقول مستحيل أصبح بحرين مثل مثل مدينة اخري بلد تميز فقط وجود
95,لو لعب فيصلي ريان كان نتيجه علم الله اضعاف خسر
96,اكبر طموح حلو ريال
97,رفع شعاراشتري اسرق غد ذلك اصبح حصانه مطمع كل حرام منافق
98,تطوير دوري شء راءع جذب
99,بد تجنب شمس طب وين راح ازا مافي
100,واي شي مفاجء
101,اما باقي خل
102,ارجو افاده
103,جماع ها سلط
104,صنع جراءم بذر شجر سام
105,اخطاء وقع مذكور ورد كثير ان اي حجاب الله ايها نبي قال لازواجك بنت نساء مءمن أدان على الاي خص امه مءمن دون ساءر ناس اري اختلاط حصل اماكن عام لا شء اما انسحب مدرسة فان
106,ذكر صادق قران فعل
107,فان ساكتب مقال اكسب ود فيصلويين خاص سيف خطاب حياه مدرس
108,مهم تغير دستور دستور جديد لايسمح اكثر فترة راءس كان محاسب لوك ريس حاسب شعب قبل جهة حدد دستور جديد انظرو اعضاء مجلس شعب كم تجاوز لا رقيب لي لان نظام عاوز
109,وش ذو شري ارض غلاء قال حديد زاد يعنيي حديد مافي ارض ارض مافي حديد يا
110,لكن تعلم ليون ليس فريسه
111,ناس احتفل جاتو كيك
112,هل وافق راي جزية خير
113,امام وطني
114,شهادة مزوره ماذا توقع
115,وش ذو مقدم شكل سمع قوه شخصيه
116,ماتوقع قبليه
117,كمان رءيس وزير سمير رفاعي حكي لازم تخلص ها قضيه اسرع وقت
118,عنى اذ اقارب حال اقتصادي جيد هو لا استحق المع
119,هل مجلس اقتصادي داعم تاجر فقط ام ان وقف حياد باءع مشتري
120,شكر اخي احمد باراك الله في قد مثل اهل حي خير تمثيل
121,قال فرق حيفا محليه شارك طول معروف انها جمع لاعب عرب لاعب يهودي في حيفا عاش عربي يهودي بناية واحد جار سمن عسل أطلق فرق نفس اسم منتخب شرط دبي ترك نفس انهزم عشرتاشر صفر انتقام فريق ضاحي خلفان قاءد شرط دبي فضح عمل موساد اغتيال مبحوح وضح عالم على
122,انتم امتحنتونا رياض كل جلد
123,تحية هلالي
124,جماع مورينهو اسكت كامب نو قال ظل ذلك متجرم صغير ترجم حرف حرف ارض ملعب تكتيك دفاعي رهيب رجل قاتل كل تركيز عشر لاعب سبعون دقيق
125,اسف شديد اري وجه نظر شاب شابة صلو مرحل حضيض فكر عدم ادراك وعي توصل مرحل رفع اعلام اعراس يومي درج غباء رفع علم برازيل الماني انجلترا هم درج عبد هل هم مكترث ام فيغا اجمع اكترث عربي اكترث عالم خارجي هم لايكترثون وجب على انن ننضج نتوعي غباء فادح رفع اعلام مونديال شارع سيارة منزل هل
126,ناس انتبه تصوير ذاك غوا يمسكوني بس نحش دودج دورني بس
127,ادو اجهز فحص
128,لا اله الا الله
129,اهنيء خادم حرم شريف ابو متعب ملك عبد الله ثاني انجاز
130,كفى تهريج رحل يهلل
131,حظ
132,واو ذو كل سوى
133,بعد دورواعليال بعد قال راي ماتخليك نرشحك انتخاب مجلس شعب
134,الله يعطيكم دوم صحه
135,عنى حكى فيصلي اكتر جمع قاب طيب تعال حسب
136,عدم غير اعدام سجن شهر ثم رحل منع دخول
137,الله جماع بابا شنوده راجل عسول علم مكانة كبيره انما رد جامد جد دم خفيف سهل ساعة أبقى أورى اسقاط حاجة معين مالاخر راجل جميل معظم ناس قدر بس حاج وحيده زعلتني من اذ صحيح موضوع تاييد مرشح حزب وطني انتخاب رءاسه ياريت كان دب لو حد متاكد موضوع يقوللي لو
138,الله كلام أثلج قلب مسلمه ري عربي مثل غيور الله
139,نواف ابن سعد اقترب اعلم
140,طلع غبار صدر اكح موت تكلم احد قال
141,دين اسلام هءلاء هم
142,جبان
143,لان سامي خير مثل مملكه محفل دوليه
144,عراقي محب فنان رد فان اعتبر فنان كبيره رد مصري قلب قالب ولاننسي اغاني حب مصر كثير امثال مصر حبيبه احب نشيد مصر عاش بلد علي ضفاف يانيل غير عديد اقول اخوان مصر كلمة جميل اغني فنان عربي رد مهما جرح احبه قسى ام أحب أنسى عاش مصر عربيه جزاءر عراق كل بلد
145,هل نسا
146,خاص حاج قمح الان ازدوج توفير غذاء توفير وقود
147,معرف مايفعلون اثناء غياب ام منزل ذهاب عمل
148,قول اقبل دور رجل ثاني حال عود جوزيه مكون شخصيه عدم
149,كل ركض خلف جمهور
150,في من راسب سن ماضي اختبار قياس علشان كذا صار عدد
151,تعليق
152,ابو تركي رد 307
153,جمع بين خير
154,الله انتم يبيلكم
155,بل ترع
156,الله كفى شر لجنة متربصه
157,قاع بحر مظلم
158,أبقى عراق ثاني فاضي
159,أبقى عراق ثاني فاضي
160,امن ضرب بنت
161,خلاص انتهي شيء ممكن تمسك بك حياء
162,مثل راتب
163,خاص امركيه صهيونيه
164,شاء
165,تلاقي عند اولاد
166,مات مريض مواطن الف مر قبل وصول واسطه
167,تستاهل ياياسر الله تستاهل خير
168,ياليت نري دوري وحد طريق خرج تتبع مخالف
169,حلم طلع حاج تاني تءيد بردعي واثق دار حيحصل ماس كهربي قضى حاج حكومه
170,شيء جميل شيء عظيم شيء روع شيء اسطوري فين مفتش تموي مبهدل جت بلاوي
171,ممكن استخدم حفاظ انواع مهدده
172,يارب فرج مافي احسن من بس لويش اولاد بس الله اعلم حال ناس مافي اكرم
173,شكر رياض شكر جن 105 شكر معلاة شكر اخ راشد
174,كتاب اهلي طايحين غزل شخصية هام انديه اخري اما نادي هو اخر اهتمام كتاب هم كيف جعل اهلي جسر تواصل اخر كيف نجح اهلي
175,كام مر صفيتلك كام مر صبر بنداري في قلب شكا
176,ضاءقه ماليه عابره مر زعيم بدا تلاشي ها سمع باني مستحق محترف اجانب سدد مستحق لاعب محلي طريق سداد ايض بعد عاد اوضاع سمن عسل يا دار دخل
177,تونس معزول عربي شيء اعتقد غير مرحب كثير سواح دليل انها طلب تاشير صادر سفارة دخول تونس بين مواطن ليبي مثل لا احتاج فيزا
178,فيصلي معني زعامه
179,انشاء زار صحه ساكن رءاس دكتور جميل الذي بذل مافي وسع وجد ادو خدم اسره اهتمام طفوله شءن اجماعيه كاف طبقة مجتمع اخشي مستقبل قريب ضم جمعية اهليه زار صحه ساكن لكن جمعية اهليه ليس كما زمن قريب قد اصاب اصاب مجتمع لان نبع افراد مثل اخلاق ساءده احتاج حزم امور صرام اتخاذ قرار تمنى استمر
180,حال انا بنت زوج ابن حلال مسلم لو قمر
181,لا ننسي خسارة مدويه تونس سبع اهداف جلب سمع سيءه انديه اردنيه بعد اطلق
182,سيد كمال قاهره رقم
183,ادار عبدالرحمن دفع مليون ادار موقره ماغير مشكلة تصاريخ
184,عماد عماد رض رجل احترام واجب مقدس ارحمونا شوي اتقى الله انفس في
185,لو ترك ابتعد اختلاط سوف عاقب الله أدخل نار
186,دامي هالاشكال اتصال اغير
187,ياجماعه خير انتم تكلم تحلل واقع دخل عالي هم نسب قليل مجتمع اما اغلبيه راتب 4000 ريال تحت احد يقولي كيف قدر وفر ادخر ظل ضروف معيشيه عالي
188,صح لسان نقل
189,صراح وجود هيء نفس وقت وجد ال امر أضعف قطاع
190,الله ذكر ايام
191,ماشاء الله اجل يبي صار مرور ثاني دخل دولة
192,احول اقو ابالله ضعف ايمان بطاله بد وعى انسان ارزاق بيد الله هاب من شاء منع اوياخرها عمن شاء صبر زين الله بيعوضك اذ موفالدنيا اخره لاتستعجل اهم شي صلاه ناس نائم
193,هادي قهر
194,دوم
195,يارب نادي محلي انهزم يووم شر
196,استاذ بر اعتذر تعليق مولود لدن استبداد تعصب استعباد لان لم عرف حريه قيمة يوم كيف كان تعليق الا سم مليء غضب كره تشكيك شكر ضمير
197,كبير الله
198,اللهم احمي بلد ابناء
199,لا بس شاطر قال دستور اردني انو دين دولة اسلام زنا عند رضي زاني حلال قانون
200,اه
201,دام
202,مشكور بس ياليت شمل مكرمه كلية بنت ضرما غير تري ثقل اهل مواصلة لا مكافء ري ينضر حال كلية دفع اهالي اكثر 500 ريال
203,غريب عجيب امرك
204,فز امس شق انفس فريق احترام لا وجد لدى خبرهولاعبين معظم صغير سن سءال طرح نفس هل فريق صلح مشاركة خارجيهام أبقى منافس قوي بطولة محليهفقط اني حد وجب كان صريح ولانجامل وحدة حاج اعاد هيكل جديد داي
205,مبارك رد على تحيه تهليل تطبيل كتب
206,شايفو انو نائب هم داعي اطلاق راح يشكلو عبء ميزانيه استنزاف مورد لي راح صار اجراء انتخاب شكلي دون رجوع
207,دولة عاوز أطلع بريء عاد بس مره موضوع مختلف لان عالم كل متابع منتظر نتيجه لان بقي جد نغل اخر ظلم دولة نظام حزب غير وطني اقباط لو لم كان كموني جاني وجب محكمة نظام حاكم كامل تقصير امساك جاني
208,زمالك
209,اضاف
210,سوف انتظر لهف ماهو
211,ياليت رحلة بس ما خفي
212,الله زمان ماكانت مثل
213,رأى ازعجتنا يالغامدي احس ناس بحث شهر دين طالع مزعج مر حلال مر وضح وجه نظر خلاص خل بنت اختلط كل حر
214,ام ثقافه يامثقف
215,لكن ملاحظ قضيه سكتم
216,عند قر خبر بادر ذهن ان تحدث افعانستان الذي يءيدون زواج طفل أراد جر اردن عصر جاهلي زواج طفل عكس حال جهل ظلم وصل الي مجتمع
217,ااذن ماذا جني ماذا استفاد ذلك تمثليه غبي
218,لا تستنجد مكتب عمل من محتمل أصاب سكر
219,لا برس حضر
220,موضوع مستحيل كثير من
221,وقف جانب رجل
222,ماء زيت تشحيم
223,موظف كاد خرج مكتب وجد وزاره خلي عمل جا
224,كمان طلع تكسي مشوار كم سايق حرق نص باكي دخان خمس دقايق
225,لكن لن يسامحك
226,رءيس اقترح ايران أرضى جزيره وافق دعا الي فتح معبر الغاء معاهده قلب حكم هدم جدار
227,لاعب مثل غالي كثير مشكلة نادي انجليزي حادث رمي فنيل فريق انجليزي غضب جمهور انجليزي جمهور انجليزي كاد اشتبك مع اكثر مناسب
228,لا ذنب احمل لا عرف
229,رب اناس من مصلحة دنيويه شهوة الان غلب اخر ومازعموا ايمان
230,نعم شيخ
231,عشان مش هشوف ماتش عشان بارسا هيعملها
232,كان عزب دارى كان اصحاب اموال ملهمش لازم هم مستحلين لاي اهواء واي افكار عبث كان دنيا داءم ليس هناك وقف فساد كان جميع موازي اختل اختلال اصحاب مفسدة طيب يباه فاضل اي غير ان قال الله مشتكي
233,خشي نشوب نار فتن دبابة لان فتان فتان لو سيبيري
234,خشي نشوب نار فتن دبابة لان فتان فتان لو سيبيري
235,خشي نشوب نار فتن دبابة لان فتان فتان لو سيبيري
236,تدهور شيء مجتمع غياب عداله ايض ضمن اسباب
237,وش على اعضاء مجلس راتب خمسون الف
238,رب نصر عارف مظلوم وان حق رب نصر سدد خط ظهر حق ظاهر راجل محترم بقي مطهدفي مكان علشان ناس بالي بال تاخد راحة
239,صوت وصل لا راح وصل حكومة طفران فا قول نلم تبرع عشان بسهرو
240,اخوان دوري 22 مبارا 66 نقطة حصل نقطة اكثر فاز
241,احسن الله عزاء
242,جيب شرك ياباني تسوي اختبار قطار صيني لان ابخص افهم
243,شاب صار يختلس عشان يامن بيت سيار هذا اخر اكبر شي فكر سعودي محترم لكن شاف دولة خليج مجاور نسب سكن متزوج داي زواج قدم سكن جاهز ياتي مد قصير اويءمن مبلغ مليون ريال سكن سكن لاق
244,اتمني جريد رياض توصيل اقتراح ادرا مرور مملكه انشاء مكحم مروري تم لان جميع معترض نظام غير مءيدين فضل باني ذهب محكم مروريه اعتراض مخالفة اذ سار طريق خطاء نظام اذ ثبت تورط مخالف تم انزال اشد عقوبة
245,حل نبذ تعصب اعمي
246,الاف سنة كان عبيد مصري بابلي دليل لوح حمورابي بيانو سجود سرقتوه احتلال امربكا
247,عدد ساكن فرنسا كما جاء موسوع ويكبيديا شهر يناير عام 2009
248,موفق يابن بلد
249,فلافيو صانع مصري يلا مبروك على تاهل ارجع ياض فلافيو الله واحشتنا وحشتنا اهداف
250,10 شريف رزق صباغ امين مجلس شعبيه أهم عضو مجلس شعبي رغم غير معروف لم قدم حزب شي سو انتخاب رءاسه نعمان جمع علاق شخصي محمد عبد عليم عضو مجلس شعب رغم غير معروف لم قدم حزب شي سو انتخاب رءاسه نعمان جمع علاق شخصي محمد عبد عليم عضو مجلس شعبي موقف معادي حزب
251,اخواني اخو هل منزل لو فقط كان صلى فرض فرض هل حدث كل سبب بعد الله عدم خوف
252,الله عظيم
253,بذل حفاظ اسره وطن يارب حفظ ابومتعب شرب جنه في ميزان حسنة شاء
254,وحدة
255,شاء الله رياض احسن احسن اذن
256,الله صلح حال
257,موضوع سمى نفخ روح اربع يوم اربع اشهر كما ذكر مقال في طب لا جاد هكذا مفهوم كما توهم بعض قارئ مقال
258,رد محاسب فليحاسب قاءم امور شعب الان ابدء
259,ماذا برنامج بالتوك
260,موقع شيخ شعراوي رحم الله الذي زال اقر اسمع من كثير كثير مرة استفاد من ايض كثير رحم الله جدي الذي اجلس جوار صغير كي اسمع مع حلقة شيخ محمد متولي شعراوي رحم الله صلا جمع استفاد كثير من تفسير اي قرانيه قاعدة لغه عربيه ابي شعريه هو رحم الله فقيه لغه عربيه
261,مءامر ضد شعب ابناء مبارك افتتح محل بيع
262,فتح عقل اوقف نزيف
263,ثاني يارب احد وصل هالسءال عنى ترجم
264,انصح كاتب اتقى الله رجل قد سبب قطع رزق سبب مجرد صورة لن تقدم تاخر نتيج
265,وصل مرحل حق باطل
266,راءع
267,جزاءريه عرف باني جزاءر داءم فاءز واد لعب ضد مصر ما فز بقي اني غش طرف
268,اذ قال ناسوت مات
269,كلام
270,اجل اوقف سيارة بعيد ادق كعابي وسرندلات غاز
271,مصري ارض جزاءر را عمل اجور مصر حلم اخر
272,رجعو امجاد مسلم رازي فارابي ابن سيناء
273,مكان نادي زمالك
274,هذا حي انساني عايه مفهاش تحرش بلاش تعقيد
275,خير خص شر عم
276,مش كفاي عملة امريكا عراق
277,مخبز ايهاب زغيبي 17 شوال نفس وزن
278,شعب فرحان مبسوط راضي
279,عقبال جمال
280,سوا موظف زوج غير موظف معروف بعض استغلال زوج كل
281,مسلوب صوت منهوب قوت سارق اوطان
282,هلال رجل
283,مصطفى رجب داه جابي
284,صفقة اسلحه اشترى دولة عربيه تم تعديل صناعة مءات مليون اجل امن
285,مخلي مواطن مفرفش هز
